"2 и 3 декабря мы с нашей командой Рунити были на HighLoad++, где рассказывали и показывали, как выглядит интернет изнутри, что представляют собой домены, хостинг и облако, на каком стеке разрабатываются наши продукты. 
А еще для всех участников конференции мы организовали интерактивную чилаут-зону, где можно было задать собственную планку мастерства в шахматной партии, попробовать на вкус наш фирменный мармелад и проверить свои знания в интеллектуальном квесте «Загадки трех провайдеров». Самым смышленым и/или удачливым мы дарили призы.",0,1
"Желательно сперва прочесть ее, чтобы вникнуть в тему. Но, так как яжэлектронщик, то после ознакомления решил попробовать решить эту задачу сугубо «железячными» методами без единой строчки кода. H-мост L298N, который формирует импульсы амплитудой 24 вольта нужной полярности, было решено оставить, как в указанной заметке, а вот сигналы для него получать на цифровой «рассыпухе» без применения контроллеров. Тем более, что такая реализация отлично подходит как учебная задача для слушателей недавно вышедших с моим участием бесплатных онлайн-курсов по цифровой схемотехнике для начинающих:",0,2
"Около трех месяцев назад я задумался о том, что в ближайшем будущем взаимодействие человека с техносферой (программно-аппаратно-сетевой инфраструктурой) будет происходить скорее через мессенджеры, такие как Telegram, чем через привычный браузер. Частое использование чатов на смартфоне быстро подтолкнуло меня к попытке снова попробовать голосовой ввод вместо привычных тапов по виртуальной клавиатуре или набора слов жестами. К моему приятному удивлению, распознавание голоса сейчас достигло очень высокого уровня как на Android, так и на iPhone. Причем настолько высокого, что STT (speech-to-text) стал для меня основным способом ввода текста в чатах, включая браузер.",0,3
"В США уже успели окрестить произошедшее «самым крупным взломом телекоммуникационных сетей в истории». Его масштабы еще только предстоить оценить. В общем, с цифровым суверенитетом и национальным инфобезом по ту сторону океана тоже как-то не складывается. И пока Штаты имеют очень смутное представление о внутренней кухне компартии Китая, его разведка прослушивает высших должностных лиц США.

Так что инфобез уровня AT&T по сути изрядно портит репутацию всей американской ИБ-индустрии. Да и контрразведки как таковой — уважаемых партнеров по блоку НАТО вряд ли интересует вектор атаки. Главное, результат. А вот за него уже как-то стыдно.",0,4
"Имена, почты, телефоны, даты рождения, страны, айпишники, хеши паролей и прочее. При этом заявление по взлому от основателя — как отдельное слово в жанре реакций на утечки такого масштаба. Вкратце, «Ну вот мы наш отдел ИБ усиляли, молились, чтобы взломы нас обошли стороной, но не сложилось. IT-отдел мы, конечно, не виним, ребята — молодцы, а вот взломщики — шантажисты и нехорошие люди. Ошибки случаются, всем спасибо».

Не то чтобы от шарашки такого плана ждешь многого, но читается все равно с легким удивлением на лице. Впрочем, казино всегда в выигрыше, так что чего им стесняться. Ну слили и слили, дальше-то что? Вы нам деньги заносить перестанете, что ли?",0,5
"На фоне таких удручающих новостей ФСТЭК решила вести рейтинг объектов критической информационной инфраструктуры по уровню ИБ. В него попадут компании с низким уровнем защиты и утечками данных. В тестовом формате служба провела анализ ~100 объектов КИИ. Как у них обстоят дела? Спойлер: не очень. Минимальному уровню защищенности соответствуют 10% компаний.

",0,6
"Что в это входит, не раскрывают. Наличие ИБ-отдела и EDR-решений? Неизвестная технология резервного копирования? Отсутствие ломаного софта и облаков без пароля с единственной копией базы? Вопросы, вопросы... Рейтинг будет иметь рекомендательный характер: без давления, аудитов и прочих мер.",0,7
"Математика, та, что выше арифметики, малоприменима в обычной жизни. Но, она нужна для общего развития личности, как и остальные «скучные» школьные предметы. Однако, если вы мечтаете пойти в науку, развивать современные технологии, вроде искусственного интеллекта, работать на Космос либо Оборону страны, то математика там более, чем востребована. Посмотрите на смартфоны, квантовые компьютеры, криптовалюту, современных роботов, включая военные разработки, тот же «Орешник», к слову. Разве они были бы возможны без математики? Но, даже если вы ограничитесь, на будущей работе, программированием либо просто работой с автоматизированными системами, то и тогда математика вам, в той или иной мере, пригодится. Другими словами, если вы хотите быть Личностью – учитесь! В идеале, учеба должна стать, вообще, вашим смыслом жизни, ради вашего успешного будущего!",0,8
"Дело в том, что Jetpack Compose — это unbundled-библиотека. В этой статье я расскажу о том, что это значит и почему оно влияет на производительность, на примере нашего переезда на Compose.

В статье мы вместе ужаснемся тому, как долго открываются экраны после переезда на Compose. Но порадуемся за то, что теперь мы не скованы версией Андроида и можем писать Compose-код с расправленными крыльями!",0,9
"Как можно увидеть на скриншотах, мы уделяем огромное внимание UI и дизайну. По всему приложению у нас разбросана куча видео.

Для нас UI-перформанс — чрезвычайно важная вещь, мы стараемся постоянно за ним следить. Возможно, какие-то из описанных в статье вещей вам покажутся незначительными, а мы — замороченными на дизайне. Но для нас эти детали очень важны.

В 2023 году мы закончили пилить нашу первую большую фичу на Jetpack Compose. Тогда к нам пришел продакт и сказал:",0,10
"Полученные числа наглядно показывают, почему нам не хватит одной метрики по кадрам. Потому что не совсем понятно, о чем эти числа нам говорят. Возьмем значение 153.8 ms. Это много или мало? Какую чиселку мне нужно здесь увидеть, чтобы я пошел и сказал менеджеру «смотри, мы все поправили»? Как она связана с теми самыми 1-2 секундами при открытии экрана?

Никак не связана! Единственное, что мы понимаем: чем ниже число, тем лучше. Мы можем воспринимать эти измерения как baseline, на который будем смотреть и следить, что метрика не идет вниз.
",0,11
"Когда мы решили удалить ее (и другие подобные кейсы) из начальной композиции, мы увидели сильный прирост производительности. Это показательный пример того, как добавляя слишком много всего в начальную композицию, можно нанести вред перформансу. Это стало для нас настоящим открытием. Но теперь мы стараемся следовать этому правилу и не добавлять в композицию того, что не должно быть видно.
",0,12
"Для некоторых из вас содержание этой статьи окажется знакомым, особенно, если вы писали встраиваемый или unsafe код на Rust. Но я этого не делал, поэтому решил, что будет полезным задокументировать свой опыт максимально подробно. Так что предлагаю сразу перейти к делу.

В прошлом году я написал программу Photohash для индексации своего NAS и поиска дубликатов фото без использования хэширования, независимого от поворота изображения, и перцептивного хэширования. Чтобы полноценно задействовать все ядра процессора и диски, эта программа распределяет работу между воркерами, отвечающими за вычисления и ввод-вывод. Происходит это распределение по каналам, представляющим синхронизированные очереди задач.",0,13
"Как и многие, я, как мог, сопротивлялся Test-Driven Development. Я не понимал, почему тесты нужно писать перед реализацией. Почему мы должны выворачивать разработку наизнанку и переворачивать естественный, как мне тогда казалось, процесс, с ног на голову.

Но, так или иначе, разработка через тестирование настигла и меня. Да, до сих пор получается не идеально, но значимость модульных тестов (а значит, и разработки через тестирование) сейчас мне видится неоспоримой.",0,14
"Тестировать в ручную это нудное занятие, лучше иметь набор тестов по которым мы можем проверить правильность работы нашей функции. В данном случае(сортировки) этот набор можно свести к функции, которая определяет правильно ли отсортирован массив, ранее описанной функции sorted-array?. Нам остаетстся лишь научиться правильно создавать сортируемые массивы. Тут нам может прийти на помощь ранее описанное рассширение генерирующее случаные числа, у кого оно не работает, задайте свой псевдослучайный генератор чисел.",0,15
"Как развитые лиспы(схемы) обрабатывают определения функций? Они раскрывают все макросы имеющиеся в функции, создают AST не имеющее макросов, а некоторые идут еще дальше и создать сначала код для виртуальной машины, а затем и для реальной, т.е осуществляют полную компиляцию функции. Тинисхема не из таких! Когда вы делаете в ней определение функции, она говорит ""ок"", и ничего не делая связывает код с указанной переменной(символом). Т.е тинисхема не раскрывает макросы на этапе опредления, так называемое - время компиляции, вероятно полагаясь на то, что успеет все это сделать, как нибудь потом, например во время вызова функции.",0,16
"И действительно во время вызова функции, тинисхема обходит дерево AST и при встрече макроса раскрывает его. Все бы ничего, но только тинисхема делает одно и то же раскрытие макроса, ровно столько раз, сколько раз поток выполнения функции посетит этот узел AST, т.е если мы используем какой то макрос в цикле, тинисхема раскроет этот макрос ровно столько раз, сколько раз будет выполняться цикл. Тоже самое произойдет и при рекурсивных вызовах функции. Поэтому к использованию макросов в тинисхеме надо подходить с особой осторожностью, и по возможности не применять их вообще!!!

",0,17
"До этого мой опыт прогнозирования включал в себя только построение «ручных» моделей в Excel. Мои модели обладали достаточно высокой степенью точности и устойчивости, включали в себя и сезонность, и случайные параметры в виде авторегрессионного процесса и доверительный интервал. Теперь мне предстояло использовать имеющийся опыт для построения современной и функциональной модели на Python или, если точнее, на PySpark – поскольку исходные данные по продажам у нас хранятся и ежедневно обновляются на кластере (DMP) и обращение к ним происходит с использованием Spark.",0,18
"Если вы сторонник pandas, то наверняка не раз задумывались о том, что работа с pandas DataFrame и sklearn не всегда является оптимальным решением. Но не останавливайтесь на этом. Несколько заинтересованных разработчиков создали sklearn_pandas — связующее звено между двумя пакетами. Он заменяет ColumnTransformer из sklearn на DataFrameMapper, дружественный к pandas. В последнее время я использую только sklearn_pandas и не разочарован. Жаль, что я не знал об этом раньше.",0,19
"В конечном итоге я многое сделал, чтобы справиться с этим - экспортировал свои результаты в Excel. Но не используя метод .to_excel . Вместо этого я использую smoother .to_clipboard(index=False), который копирует данные в буфер обмена. Затем я использую Ctrl + V в Excel, чтобы вставить данные в мою текущую электронную таблицу. И вот, пожалуйста, вы можете выпустить на волю зверя Excel, который сидит внутри вас.",0,20
"К тому же, нам нужно было собирать системы из множества компонентов, но без использования JavaScript. Когда мы попробовали Jmix, поняли, что для небольших проектов, например, для вывода простой статистики, это идеальный вариант. На Jmix можно писать и фронт, и бэк на одном языке — Java.

А еще у Jmix хорошая документация, так что в нем можно быстро разобраться. Плюс это open source, а значит, можно легко подключать джунов, чтобы они учились и развивались.",0,21
"Также Jmix предлагает удобный API для работы с базами данных. Это упрощает создание сложных запросов и управление данными. Можно легко интегрировать приложение с разными источниками: реляционные базы данных, MongoDB, PostgreSQL, RabbitMQ, Redis, геосервисы, NoSQL-хранилища, REST-сервисы.

Это реально облегчает жизнь разработчикам. Теперь у нас есть готовый шаблон для чат-ботов, в котором собраны все необходимые библиотеки и компоненты. Мы можем буквально за пару кликов развернуть новый проект на тестовом сервере через Docker-образ, а дальше программист подстраивает его под задачи клиента: убирает ненужное и добавляет новые фичи для бота.",0,22
"С редактированием тоже заморачиваться не надо. Например, в Jmix есть готовый плагин с дашбордами — все они информативные и понятные, а еще загружаются и настраиваются без проблем. Серьезно, в админках Python или PHP такого нет, а здесь есть. По-моему, это успех.",0,23
"Next.js — штука прекрасная, но фича его компонентного подхода может быстро стать вашим злейшим врагом, если не подойти к CSS грамотно. Один из ключей к надежному проекту — это модульность и предсказуемость CSS. Хочется не думать о том, «где оно там стилизуется», а спокойно пользоваться компонентами.",0,24
"BEM — это структурная спасалка для ваших стилей. Понятный принцип, который структурирует CSS по блокам, элементам и модификаторам. BEM-интерфейсы к Next.js модулям легко «ложатся» на CSS-модули.",0,25
"OOCSS про то, чтобы создавать стили, которые можно тасовать между компонентами, как карточную колоду. Основная идея здесь — разделяй и властвуй, а именно: разделяй стили на структуру и оформление, чтобы переиспользовать один и тот же шаблон, изменяя только визуальные детали.

Допустим, есть базовая карточка (без изображения) и карточка с изображением, где стиль .card--with-image просто меняет расположение элементов внутри карточки. Это делает стили гибкими, так что можно добавить новое оформление без изменения самой структуры.",0,26
"Как говорил классик – позвольте мне 30 секунд исторической справки. Все примерно слышали, что сайты работают через протокол HTTP/ HTTPS. Для упрощения возьмем протокол HTTP. Данный протокол текстовый (и работает поверх протокола TCP описание работы которого мы опустим), но что нам это говорит? По сути, это просто строка, в которой определенным способом хранится информация. То есть, по сути, вся работа сайта — это отправка и получение строк в определенном формате. Вот и все. Возможно, для кого-то это покажется слишком простым, но так оно и есть. Когда вы открыли сайт, на самом деле вам пришла текстовая строка, которую браузер обработал и вам отобразил.",0,27
"Составление схемы процесса с помощью BPMN — это не просто создание красивых диаграмм. Речь идет о ясности — о том, чтобы видеть не только задачи, но и то, как они связаны между собой и в чем заключается их важность. Такой взгляд с высоты птичьего полета может стать решающим фактором в выявлении и устранении недостатков, что приведет к принятию более разумных решений как в бизнес-стратегии, так и в проектировании пользовательского опыта.",0,28
