"Более интересный вопрос — нужно ли транспилировать код в пониженную версии ES для более старых рантаймов. На сервере или локально (node / deno / bun) код с неподдерживаемым синтаксисом взорвется. Для браузера код пройдет через бандлер, но оттранспилируется ли он? В vite — да, весь код пройдет через esbuild. А для webpack базовый babel-loader явно рекомендуют для node_modules отключить. То есть возможность до-транспилировать код для браузера есть, но ее часто придется настраивать вручную.",0,310
"Скажу честно: ни плюсы, ни минусы бандлинга не кажутся мне очень убедительными. Единственное, в чем я уверен — ощутимая разница будет только а) для времени обработки бандлером, и б) только для очень больших библиотек. Отдельный вопрос — стоит ли бандлить .d.ts файлы. Вполне допускаю, что это полезно, но пока не готов глубоко рисерчить эту тему. В другой раз.

А, чуть не забыл: главное правило бандлинга библиотек — не вбандливайте зависимости. Представим: мы используем date-fns в библиотеке, наш пользователь использует date-fns в своем приложении. Если date-fns вбандлить в нашу библиотеку, к конечным пользователям поедет два date-fns. Нехорошо. Касается и обычных dependencies, и (особенно) peerDependencies.

",0,311
"Сегодня мы поговорим о данных, которые представляют собой весьма специфичный случай, а именно о «шумных» данных. Предлагаю вам поразмыслить на тему обратного инжиниринга применительно к таким данным и попытаться поставить всё с ног на голову. О чем речь: не так давно мы написали модель машинного обучения по предсказанию одного тренда и пытались улучшить ее предсказания, применяя различные модификации фильтра Калмана (Kalman Filter, EnKF, Kalman Filter + Numba, EnKF + Numba. Другими словами, фильтровали обучающую и тестовую выборку в надежде поднять скор на модели, выделив более качественный сигнал. При этом получили, в целом, весьма хорошее решение.",0,312
"Никто не любит проектный офис. Никому не нужны его регламенты, которые только тормозят проекты и заставляют руководителей заполнять ненужные бумажки. Никто не хочет соблюдать все эти многочисленные «правильные процедуры», когда можно договориться с нужными людьми в курилке и получить нужные ресурсы. 

Положение проектного офиса – часто очень непростое. Это не то подразделение, которое напрямую влияет на важные показатели бизнеса. Это не производство и не продажи. Даже не бухгалтерия со своим авторитетом. Это то подразделение, которому каждый день приходится доказывать свою полезность и нужность. 
",0,313
"Основная часть работы современных разработчиков ПО1 связана с API: публичными интерфейсами для общения с программой, например, API Twilio. Я потратил кучу времени на работу с API как их разработчик и пользователь. Я писал публичные API для сторонних разработчиков, приватные API для внутреннего использования (или для потребления одной страницей фронтенда), API REST и GraphQL и даже несетевые интерфейсы, например, для инструментов командной строки.

Думаю, большинство рекомендаций по проектированию API слишком уж уходит в тонкости. Разработчики отвлекаются на обсуждения того, что же такое «реальный» REST, правильно ли использовать HATEOAS и так далее. В этом посте я попытаюсь рассказать всё, что знаю о проектировании хороших AP",0,314
"Ansible — один из самых популярных инструментов автоматизации, но многие до сих пор используют его, ограничиваясь лишь командой ansible‑playbook. С 2012 года Ansible вырос из простого инструмента в мощную экосистему, решающую проблемы с зависимостями, тестированием и централизованным управлением. Если вы все еще боретесь с конфликтами версий Python на хосте или пишете Ansible‑контент без тестов — эта статья для вас.

Мы разберем современный инструментарий Ansible — от Execution Environments и Ansible Navigator до Event Driven Ansible и AWX. Вы узнаете, как эти компоненты превращают Ansible в полноценную платформу автоматизации, готовую справляться как с задачами небольших команд, так и с вызовами крупных компаний. А для начала немного истории, ведь название Ansible пришло к нам прямиком из научной фантастики",0,315
"В процессе обсуждения первой части пришло понимание, что контроллер IDE всё же следует наделить некоторым ""умом"". Шина USB заточена под поточную передачу данных и поэтому Ping-Pong протоколы на ней откровенно тормозят, приводя к не оптимальному использованию самой шины. Это выливается и в тормоза на шине IDE, поэтому было принято волевое решение создать вторую версию контроллера, более умного, но в то же время не сильно усложнённого, чтобы он позволял как прямое управление шиной так и мог реализовывать базовые протоколы IDE без необходимости обращения к хосту. Если вам всё ещё интересна данная тема - добро пожаловать под кат.
",0,316
"Старый добрый танк фронтенда — медленный, но мощный. Гибкий до предела, он тащит всё: от микрофронтендов до легаси, являясь по-факту стандартом индустрии (особенно корпоративной разработки) с 2014 года. К webpack можно относится по-разному, однако всё же стоит признать, что если его хорошо настроили, то стабильно работать он может даже дольше, чем будет жить проект (конечно не без греха в виде долгого старта, прожорливости и сложной конфигурации).",0,317
"Во-первых, у нас не было процессов по регистрации и разбору инцидентов — мы плыли по течению. Только создание команд мониторинга и инцидент-менеджеров помогло нам начать грамотно учитывать инциденты и извлекать из них уроки.

Во-вторых, миллионы алертов по всем сервисам летели напрямую в разработчиков. Нагрузка — огромная! Разрабам приходилось и днем и ночью подключаться к анализу аномалий, на которые сработали алерты. Сейчас отработка алертов возложена на инженеров мониторинга, и разработка подключается только в случае подтвержденного влияния.
",0,318
"Когда пришло время, пилить начали все. Создание отдельных микросервисов на смену кодовым частям в монолите превратилось в техдолг, на который выделялось 25-30% времени от общей разработки. Параллельно нужно было развивать фичи и двигать бизнес вперед.

Но со временем выделились разработчики, которые погружались в процесс сильнее остальных. Они быстро росли в компетенциях декомпозиции монолита и, самое главное, им это было интересно. Заметив высокую эффективность этих коллег, разработка и бизнес объединили их в одну команду. Компания получила внутреннюю “аутсорсинговую” команду, на 100% сфокусированную на распиле монолита – ту самую платформенную команду техдолга, в которой я работаю.

",0,319
"RPA (Robotic Process Automation) – те самые технологии, которые используют программных роботов, позволяющих автоматизировать повторяющиеся/ рутинные задачи в бизнесе. Это направление стремительно развивается из некогда «местечковых» решений до комплексных стратегий гиперавтоматизации. 

Впервые ЭВМ были использованы в бизнес-процессах в пятидесятые годы (UNIVAC, IBM 702). В те времена компьютеры выполняли простые задачи в бухгалтерии, складском учёте, статистике.  Сегодня же речь идет о сквозном подходе, который направлен на создание взаимосвязанной экосистемы автоматизированных процессов, включая внедрение ИИ-инструментов.
",0,320
"С момента запуска ChatGPT в конце 2022 года капитализация американского фондового рынка выросла на $21 трлн. По данным The Economist, более половины этого роста ($11.55 трлн) приходится всего на десять технологических гигантов, включая Amazon, Broadcom, Meta и, конечно, Nvidia.

Этот инвестиционный бум стал ключевым драйвером американской экономики. В первой половине 2025 года он обеспечил весь рост ВВП США. В то же время треть всех венчурных инвестиций на Западе направляется в ИИ-стартапы. Эта активность объясняется убеждением, что ИИ кардинально изменит экономику. Инвесторы из Sequoia Capital считают, что революция ИИ превзойдёт по масштабу даже промышленную революцию, а некоторые, как Гэвин Бейкер из Atreides Management, и вовсе говорят о гонке за создание «цифрового бога».",0,321
"Порой разработка нового продукта, автоматизация существующего процесса выглядит, как работа хирурга, который провел сложную операцию: в моменте избавил человека от серьезной проблемы, а то и вовсе спас жизнь. И на этом, как правило, история заканчивается. Однако после каждой операции есть еще одна очень важная стадия, о которой почему-то не принято говорить - это реабилитация. И от того, как она пройдет, зависит работоспособность органов и качество жизни.

В IT-разработке тоже есть такая стадия - это поддержка того, чем осчастливили заказчиков. Если ее упустить, то даже идеально проведенная «операция» может закончиться осложнениями. Поэтому для аналитика понимание этой стадии не менее важно, чем участие в создании нового продукта.",0,322
"Насколько облака удобны и приятны в использовании, настолько же они и непредсказуемы. Особенно, если не перестроить «железную» модель бюджетирования под облачную. В этом случае практически гарантирован исход, при котором инфраструктурные затраты будут превышать планы в полтора, а то и два раза. Сказывается невозможность контролировать расходы вручную. Слишком уж много нюансов и переменных влияет на итоговый счет. Обычно проблему решают специализированные FinOps‑инструменты, но они чаще всего, либо дорогие, а потому не подходят для начинающих, либо попросту не учитывают особенностей российских платформ. Но у FinOps Radar этих недостатков нет.",0,323
"Я столкнулся с проблемой зависания данных на часах, что стало проблемой, особенно когда речь идет о занятии сопртом. Мне нравится велосипед и во время тренировки удобно отсматривать показатели только одной рукой и управление спортивным режимом (в этом форке он нами так же добавлен в основное приложение) желательно только на часах.

Дополнено включение и настройка спортивного режима не только в app, но и в wear, а так же была исследована проблема залипания данных (когда на часы данные о глюкозе приходят не вместе с обновлением на телефоне, а гораздо позже или переодически например всего несколько раз в час, не стабильно). При этом сейчас данные приходят как правило быстрее чем за 7 минут (на часы). Если быть точным - обновление и показ происходит не позже 7 минут.",0,324
"Но в связи с устаревшими решениями по коду я решил форкнуть либу. оказалось, что механизм библиотеки достаточно прост - она использует открытые api mail.tm.

Проведя небольшой ресёрч в интернете я нашел mail.gw, который выглядит/работает также, как mail.tm и с которым, как оказалось, уже может работать мой форк.

Но, есть проблема: при регистрации аккаунта сервис легко обнаруживает временные почты (предположительно, по черному списку доменов, но у меня есть решение, расскажу в конце).

Значит нам предстоит развернуть собственный сервер временной электронной почты на собственном домене.",0,325
"Что действительно делает программу великой? Скорость работы, поражающая воображение? Лаконичность и изящество кода, восхищающие коллег? Или, быть может, Архитектура, обещающая вечную гибкость? Тысячи лет все эти империи рушились перед лицом коварной Ошибки. Пришло время провозгласить манифест иной истины: высшая ценность программы — её Достоверность, и цель разработки — доказать, что программа безупречно воплощает замысел своего создателя. В данной статье мы рассмотрим инструменты и методы, которые превращают намерение программиста в неопровержимую теорему. Через формальную верификацию тривиального, но коварного ФиззБазза средствами Idris 2 мы покажем, как строить программы, чья правильность не вера, но математический факт. Зависимые типы — наш меч. Добро пожаловать в мир, где код не просто работает — он доказан.",0,326
"Нейронки периодически оказывают пользователям медвежью услугу и уверенно (инфа сотка!) выдают в ответ на запрос правдоподобные фейки. Если речь идет о журнальных статьях на тему «что почитать этим летом», получается веселый конфуз.

Совсем другое дело — если «срезать углы» с помощью нейросети хочет юрист, ученый или эксперт, пишущий книгу в жанре технической литературы.
",0,327
"В конце 90-х годов ноутбуки начинают избавляться от имиджа средств выражения высокого статуса или производственной необходимости: компании-производители выходят со своими новыми моделями на базе процессоров Pentium MMX и Pentium II на потребительский рынок. В частности, компания Fujitsu меняет классификацию модельного ряда и вводит различные линейки для различных рынков. Для широких масс назначается линейка, обозначаемая буквой C (по-видимому от слова Consumer, т.е. потребительский). В этой статье на примере Fujitsu LifeBook C3 посмотрим, какими были эти потребительские ноутбуки.
",0,328
"Наконец, последнее направление связано с созданием не просто языковых моделей, а фундаментальных моделей, работающих с разными модальностями (типами данных). На самом деле, любую информацию можно свести к языку — даже математические формулы можно просто описать словами. Однако в этом направлении предлагается переосмыслить текущие подходы и развивать модели с новой математикой для описания этих различных модальностей.

Также до сих пор нет единого математического обоснования нейронных сетей, лишь отдельные области и лишь отдельная математика. А когда будет единая теория не ясно.",0,329
"Мы уже разобрали, зачем нужна CSMA, какие проблемы есть у «зоопарка» средств защиты, и прошлись по ключевым слоям: SAIL (интеллект аналитики), управление инфраструктурой и Identity Fabric. Логичный следующий шаг - навести порядок там, где у большинства организаций сегодня хаос: в политиках, конфигурациях и операционном управлении.

Эта статья про PPPM - централизованный уровень Policy / Posture / Playbook Management. Его задача - стать единым источником истины для политик и стандартов конфигурации, согласовать «бизнес-ограждения» для автоматизации, и соединить SAIL с точечными продуктами через открытые API и policy-as-code (OPA, Cedar, Zanzibar, XACML). Здесь же - привязка к контрольным наборам NIST/CIS/ISO, устранение дрейфа настроек и подготовка к безопасной частичной авто-оркестрации.",0,330
"Звучит просто: подключил суперсовременную LLM к десятку инструментов — и пусть решает любые задачи в реальном времени. Только вот на практике всё выходит куда прозаичнее. Даже самые мощные модели уверенно работают в лабораторных условиях, где всё строго по шаблону. А стоит им оказаться в живой, шумной среде — появляются ошибки, неожиданные сбои и довольно неожиданные выводы о том, где у современных ИИ-агентов на самом деле слабые места. Новое исследование показывает, что, когда у модели есть сотня способов решить задачу, успех — далеко не гарантирован. Почему даже мощные LLM так часто спотыкаются на пустом месте и что им мешает делать работу, как человек — разберёмся на ярких примерах из нового бенчмарка LiveMCP-101.",0,331
