"В ходе анализа публикаций на платформе Reddit неоднократно встречались сообщения, в которых метод S3 FIFO сравнивался с алгоритмом LRU (Least Recently Used). В этих публикациях отмечалось, что S3 FIFO обеспечивает более низкий процент промахов кэша по сравнению с LRU.

Данный факт представляется значимым, учитывая, что такие компании, как RedPandas, Rising Wave и Cloudflare, уже интегрировали технологию S3 FIFO в свои инфраструктуры. Поскольку эффективное управление кэшированием является важной задачей в области обслуживания распределенных систем, возникла необходимость проведения тестирования метода S3 FIFO или, по крайней мере, обеспечения глубокого понимания ключевых принципов, лежащих в основе данной технологии.",1,90
"В процессе трудовой деятельности может сложиться впечатление, что приступать к изучению нового подхода к кэшированию преждевременно, поскольку еще не освоена аналогичная система, используемая в работе.

В команде для работы с кэшем применяется библиотека Caffeine. Стоит отметить, что на момент начала изучения данного инструмента я не был знаком с его внутренним устройством и не пытался проверить, можно ли в нем что-либо настроить или отрегулировать.

Цель данной статьи — описать проведенное исследование и поделиться личным опытом изучения внутреннего устройства библиотеки Caffeine.",1,91
"В данном тексте описывается процесс формирования хеш-значений для элементов с использованием функции spread, которая «размазывает» хеш-код входного элемента e, обеспечивая более равномерное распределение хеш-значений. Затем к результату функции spread (обозначаемому как blockHash) применяется функция rehash, что дополнительно перемешивает содержимое blockHash и создает новое хеш-значение для индексирования в 16 различных хеш-цепочках. Для определения блока используется операция (blockHash & blockMask) << 3. Чтобы понять этот процесс, необходимо рассмотреть вычисление значения blockMask, которое определяется выражением (table.length >> 3) - 1. Сдвиг значения длины таблицы table вправо на 3 разряда эквивалентен делению на 8 с учетом структуры данных. Поскольку каждый блок в массиве table содержит 16 счетчиков, а ширина каждого счетчика составляет 4 разряда, общий размер блока равен 16 * 4 = 64 разрядам (8 байтам). Таким образом, сдвиг таблицы table вправо на 3 разряда позволяет вычислить количество блоков в массиве, а вычитание 1 задает диапазон возможных значений от 0 до (table.length >> 3) – 1. Например, если длина таблицы равна 256, то операция (table.length >> 3) возвращает 32, а вычитание 1 дает значение 31, что в двоичном представлении соответствует 11111. Это покрывает все 32 возможных значения от 0 до 31.",1,92
"В контексте данной реализации, основанной на использовании сигнальных узлов, головной и хвостовой узлы всегда имеют ненулевое значение. Это позволяет безопасно обращаться к полям head.next и tail.prev без выполнения дополнительных проверок на null.

Однако в рассматриваемой реализации без использования сигнальных узлов первый и последний элементы могут иметь значение null. В этом случае необходимы дополнительные проверки на null. 

При обращении к полю или методу потенциально нулевого объекта JVM автоматически вставляет в байт-код проверку на null. Если объект имеет значение null, то будет выброшено исключение NullPointerException.

Авторы данной реализации структурировали код таким образом, чтобы явно обрабатывать случаи возникновения null. Благодаря этому удалось избежать автоматических проверок на null и связанных с ними потенциальных исключений NullPointerException в критических путях кода.",1,93
"LUKS — это инструмент для шифрования данных. С его помощью можно зашифровать диск или создать файл-криптоконтейнер.

Однако использование LUKS может вызвать определенные опасения, поскольку его присутствие легко обнаружить. Это большой бинарный файл с определенной сигнатурой, который несложно найти, даже если он спрятан в глубине файловой системы. После обнаружения файла у посторонних могут возникнуть вопросы к владельцу.",1,94
"В операционной системе Linux существует возможность подключения файла как блочного устройства, при этом не обязательно подключать весь файл целиком. Можно подключить только определенный фрагмент внутри файла.

В результате внешний вид файла не изменится, и сигнатуры будут отображаться корректно. Однако внутри файла будет содержаться другая информация.

Для обнаружения определенных данных внутри файла можно провести его сканирование. Например, найти сигнатуры LUKS. Но это не единственный способ. Существует инструмент, который позволяет применять прозрачное шифрование напрямую.

При использовании этого инструмента некоторые блоки данных внутри файла будут зашифрованы так же, как блоки диска. Если не знать, какие именно блоки были зашифрованы и с каким ключом, то обнаружить их становится намного сложнее.",1,95
"В качестве контейнера можно использовать любой достаточно большой файл, например, видеозапись или образ DVD. После подключения файл будет частично поврежден, но по-прежнему будет определяться как видеозапись или образ диска.

Внутри файла не появятся распознаваемые сигнатуры, что усложняет автоматический поиск скрытых дисков.",1,96
"В процессе разработки программного обеспечения часто возникает ситуация, когда приложение выполняется на множестве процессоров. Многие предположения, корректные для одноядерных систем, оказываются недействительными в многопроцессорной среде.

Рассмотрим ситуацию, когда два процессора одновременно изменяют один и тот же блок памяти. В этом случае определение конечного состояния памяти становится затруднительным, поскольку изменение, внесенное одним процессом, может перезаписать изменение другого, либо изменения могут «конфликтовать», приводя к состоянию, не соответствующему ни одному из ожидаемых результатов. Такая ситуация характеризуется одновременным доступом двух или более процессоров к одной области памяти, при котором хотя бы одна из операций доступа выполняется с записью без соответствующей синхронизации.

Подобные операции доступа называют «гонками данных». Гонки данных представляют собой состояние, в котором неконтролируемое одновременное выполнение операций на одной области памяти приводит к неопределенному результату, что существенно усложняет обеспечение корректной работы многопроцессорных систем.",1,97
"Когда процесс достигает шлюза, механизм обработки выполняет считывание списка идентификаторов исходящих потоков и осуществляет поиск их определений. Поток, который будет найден первым, становится начальным.

Определения потоков могут быть расположены в XML-файле в любом месте, не обязательно сразу после шлюза. Элементы в модели располагаются в том порядке, в котором они были созданы. Если происходит интенсивное редактирование процесса, включая добавление и удаление блоков и стрелок, содержимое XML-файла может стать перемешанным. Однако для механизма обработки это не имеет значения.

Вернемся к рассматриваемому эксклюзивному шлюзу (exclusive gateway) и найдем определения его потоков. Также стоит отметить, что использование осмысленных идентификаторов для BPMN-элементов делает модель более читаемой и упрощает работу с логами.",1,98
"В рассматриваемом процессе для второго исходящего потока не задано условие. Согласно логике работы, если условие не задано, оно считается истинным. Это означает, что при изменении порядка потоков движок не будет вычислять выражение forecast == ""rain"", а сразу перейдет к пути с меткой Flow_clear.

В результате, если разработчик забыл установить условия на выходах из шлюза ИЛИ, процесс может повести себя непредсказуемо — он может выбрать неправильное направление, даже если значения переменных соответствуют ожиданиям.

Важно отметить, что BPM-движки Camunda и Flowable не проверяют наличие условий на исходящих потоках при деплое процесса. Из-за этого ошибку бывает трудно обнаружить.",1,99
"В случае возникновения ситуации, когда пользователь осуществляет выход за границу массива и отправляет core dump, необходимо провести ряд действий:

1. Открыть задачу на баг.
2. Провести поиск и исправление бага.
3. Выполнить проверку исправлений.
4. Произвести пересборку программного обеспечения.
5. Выдать обновленную версию пользователям.

Этот процесс может занять несколько часов. В данном случае представлен оптимистичный сценарий, при котором по сообщению пользователя сразу понятно, где именно возникла проблема.

Иногда поиск подобных дефектов может потребовать длительного времени из-за сложностей с определением причин сбоев у клиентов. Это может привести к потере ресурсов и репутации.",1,100
"Официальное отдельное мобильное приложение у lsFusion не предусмотрено. Однако на практике компания активно использует мобильные интерфейсы.

Многие процессы, например, в системе управления складом LSF WMS, выполняются на мобильных устройствах, часто с использованием сканеров. Это реализуется по принципу адаптивного дизайна. 

Платформа определяет, загружается система с компьютера или мобильного устройства, ориентируясь на размер экрана. Если устройство оказывается мобильным, система применяет стили, подходящие под такие устройства, и формирует навигационное меню для корректного отображения на небольшом экране.",1,101
"В рамках выполнения задачи возникла необходимость в организации хранения структурированных данных в бинарном формате, а также их передачи и обнаружения в «замусоренном» потоке.

Работа над проектом началась с предположения о его небольшом и несложном характере. Однако со временем проект начал разрастаться. Для таких проектов обычно используется минималистичный стек технологий.

В данном случае потребовалось сохранять данные с нескольких потоков — логи. Это было решено путем записи данных в файл.",1,102
"
В ходе практической деятельности неоднократно возникала необходимость работы с данными, требующими структурирования для хранения, обеспечения возможности примитивного поиска и предоставления быстрого доступа к отдельным их фрагментам.

Для решения данной задачи требовался инструмент, обладающий более широким функционалом по сравнению с простейшими хранилищами данных, но при этом менее сложный, чем полноценная база данных. Особое значение имело условие типизации данных.

В этой связи предлагается рассмотреть набор инструментов под названием brec (BinaryRECord), предназначенный для создания протокола данных, оптимизированного для их хранения и передачи.",1,103
"В контексте искусственных нейронных сетей, нейроны представляют собой элементы, в которых производятся вычисления. Для определения относительной важности входных данных используются веса. Вес (weight) — это числовой коэффициент, на который умножается каждое входное значение. Обозначаются веса буквой w.

При отсутствии входного сигнала возникает необходимость использования смещения (bias). Смещение позволяет генерировать выходной сигнал даже при отсутствии входных данных, обеспечивая активацию нейрона. Смещения обозначаются буквой b.

После изучения архитектуры персептрона можно перейти к наглядной демонстрации процесса вычислений в данной нейронной сети.",1,104
"Специалисты, имеющие опыт разработки миграций для баз данных SQL, осведомлены о возможности их реализации с использованием Entity Framework Core (EF Core). Рассмотрим особенности данной процедуры на примере PostgreSQL. Данная система управления базами данных (СУБД) обеспечивает строгую валидацию структуры данных, исключая возможность внесения записей, не соответствующих установленной схеме. В качестве иллюстрации: при наличии модели данных, содержащей три поля (идентификатор типа Guid, строковое значение Name и числовой параметр Age), попытка внесения дополнительного поля NameWithAge окажется невозможной ввиду отсутствия соответствующего столбца в структуре таблицы. Для модификации схемы базы данных разработчики применяют механизм миграций, позволяющий преобразовать существующую производственную схему в обновлённую версию. Данный процесс характеризуется сохранением целостности исторических данных при одновременном обеспечении возможности работы с расширенным набором атрибутов в соответствии с обновлённой структурой.",1,105
"Для хранения сведений о текущей версии схемы достаточно использовать отдельную таблицу. Подобным образом функционирует Entity Framework Core: он сохраняет информацию обо всех выполненных миграциях в таблице __EFMigrationsHistory.

Если была выполнена миграция, то механизмы базы данных (БД) проверяют, чтобы все записи соответствовали формату обновленной схемы. Таким образом, невозможно будет обнаружить ни одной записи, в которой отсутствовали бы добавленные данные NameWithAge. В свою очередь, БД не допустит добавления новых записей без поля NameWithAge.",1,106
"В контексте использования EF Core, если не доверять механизму миграций и писать SQL-скрипты под каждое изменение схемы, это может быть неудобно. Гораздо удобнее, когда есть возможность программно создавать скрипты миграций, которые автоматически выполняются при старте приложения.

При использовании MongoDB в отличие от EF Core возникает проблема: приложение не может определить текущую версию схемы базы данных для применения миграций обновления. Это связано с тем, что средства MongoDB не контролируют схемы данных. Следовательно, нельзя полагаться на данные о каждой примененной миграции из __MigrationsHistory, поскольку в коллекции документов могут храниться как документы с обновленной схемой, так и документы старой схемы.

В большинстве случаев поступают следующим образом: хранят версию каждого документа в самом документе.",1,107
